,Well_Name,Header,Sub_Header,Barcode,File Name,Desc
0,RAJAMANDALA-13,Report,Report,WR01341412,WR01341412.pdf,PALYNOSTRATIGRAPHY OF THE INTERVAL 3786M TO 3979M
1,RAJAMANDALA-13,Report,Report,WR01341415,WR01341415.pdf,SPECIAL CORE ANALYSIS WELL
2,RAJAMANDALA-13,Report,Report,WR01341411,WR01341411.pdf,"WELL PETROLEUM GEOCHEMISTRY SCREENING, GAS AND CONDENSATE CHARACTERISATION STUDY, MARCH 2009"
3,RAJAMANDALA-13,Report,Report,WR01341409,WR01341409.pdf,GEOLOGICAL COMPLETION REPORT
4,RAJAMANDALA-13,Report,Report,WR01341423,WR01341423.pdf,FINAL REPORT POSITIONING OF SEMI SUBMERSIBLE RIG OCEAN GENERAL
